{
    "schemaVersion":  1,
    "status":  "COMPLETED",
    "generatedAtUtc":  "2026-09-03T05:58:24.0697608+00:00",
    "fixedIndex":  {
                       "collection":  "task2-default-20260903T190000Z",
                       "embeddingDeployment":  "text-embedding-3-small-1",
                       "corpus":  "EPAM_JavaSecureCodingGD.md",
                       "ingestionCount":  1
                   },
    "generatorSelection":  {
                               "usedConfiguredDefault":  true,
                               "configuredDefaultDeployment":  "gpt-5-mini-2025-08-07",
                               "resolvedDeployment":  "gpt-5-mini-2025-08-07",
                               "deploymentEnvironmentVariable":  ""
                           },
    "results":  [
                    {
                        "deployment":  "gpt-5-mini-2025-08-07",
                        "suite":  "Comparison",
                        "case":  "Simple",
                        "question":  "According to the EPAM Java Secure Coding Guidelines, which examples of secrets must not be stored in code or data, and why is code obfuscation insufficient?",
                        "config":  {
                                       "topK":  5,
                                       "similarityThreshold":  0.3,
                                       "embeddingDeployment":  "text-embedding-3-small-1",
                                       "collection":  "task2-default-20260903T190000Z"
                                   },
                        "latencyMs":  6999,
                        "httpStatus":  200,
                        "status":  "NOT_PROVEN",
                        "response":  "Don\u0027t store secrets such as cryptographic keys, passwords, or algorithm in code or data, because hostile JVMs can quickly view this data, and code obfuscation doesn\u0027t really hide the code from serious attackers.",
                        "sources":  [
                                        {
                                            "documentName":  "EPAM_JavaSecureCodingGD.md",
                                            "chunkId":  "d48c448520876fba7200fc5e7ec85201589cd82ddcff8d7f73d0f4d69a43739d"
                                        },
                                        {
                                            "documentName":  "EPAM_JavaSecureCodingGD.md",
                                            "chunkId":  "6cc410d74e9839fcf3b6002f6f07aae6735420e071af9129f537363b6fccc5c7"
                                        },
                                        {
                                            "documentName":  "EPAM_JavaSecureCodingGD.md",
                                            "chunkId":  "e359ecb9e0b37281ec77b99fe6a55f18203abcac09ed1aeebefc27e5f64582f8"
                                        },
                                        {
                                            "documentName":  "EPAM_JavaSecureCodingGD.md",
                                            "chunkId":  "707e1a74e590c11c6fa6bfea6529c226267a95cb563cf739e88985a2f3d29945"
                                        },
                                        {
                                            "documentName":  "EPAM_JavaSecureCodingGD.md",
                                            "chunkId":  "71e83c70b2bd7e08cc21087d066b4a7b2b630729e371583edeada28a3f54ad6b"
                                        }
                                    ],
                        "retrievalScoresAvailable":  false,
                        "rubric":  {
                                       "pass":  null,
                                       "notes":  "Every concrete example and reason must be supported by section 2.1.6; any unsupported or altered fact fails.",
                                       "sourceFaithful":  null,
                                       "refusalCorrect":  null,
                                       "sourceShapeValid":  null,
                                       "manifestMatchVerified":  null,
                                       "contentRelevanceVerified":  null,
                                       "agentReviewRequired":  false,
                                       "sourceAttributionCorrect":  null
                                   }
                    },
                    {
                        "deployment":  "gpt-5-mini-2025-08-07",
                        "suite":  "Comparison",
                        "case":  "Detail",
                        "question":  "What protections does the policy require around a native method wrapper, including the defensive copy and the overflow-safe offset and length validation?",
                        "config":  {
                                       "topK":  5,
                                       "similarityThreshold":  0.3,
                                       "embeddingDeployment":  "text-embedding-3-small-1",
                                       "collection":  "task2-default-20260903T190000Z"
                                   },
                        "latencyMs":  7380,
                        "httpStatus":  200,
                        "status":  "NOT_PROVEN",
                        "response":  "- Do not declare the native method public: make the native method private and expose the functionality through a public Java-based wrapper that performs checks before calling the native method.  \n- Make a defensive copy of mutable input in the wrapper (example: data = data.clone()).  \n- Validate offset and length in a way that avoids integer overflow: ensure offset \u003e= 0, len \u003e= 0, and offset \u003c= data.length - len; if these checks fail, throw an IllegalArgumentException.  \n- Perform all necessary input validation in the wrapper prior to invoking the private native method.",
                        "sources":  [
                                        {
                                            "documentName":  "EPAM_JavaSecureCodingGD.md",
                                            "chunkId":  "0e60f799dc31b0645ae23a3dc3fe474a805a7b9737234b43f2640d877d63f971"
                                        },
                                        {
                                            "documentName":  "EPAM_JavaSecureCodingGD.md",
                                            "chunkId":  "71e83c70b2bd7e08cc21087d066b4a7b2b630729e371583edeada28a3f54ad6b"
                                        },
                                        {
                                            "documentName":  "EPAM_JavaSecureCodingGD.md",
                                            "chunkId":  "a49355dd27bf89426518474e26e740366665ce689f1bf40f3ef90d8e55d44a7a"
                                        },
                                        {
                                            "documentName":  "EPAM_JavaSecureCodingGD.md",
                                            "chunkId":  "c4004f4b511927636392c73e742b3d4593dab2a9541743be92a3ca0dac8eb724"
                                        },
                                        {
                                            "documentName":  "EPAM_JavaSecureCodingGD.md",
                                            "chunkId":  "3d65605762de7ec76fcc394ab2aac35bf157df2b01649f092c253ccc27f16788"
                                        }
                                    ],
                        "retrievalScoresAvailable":  false,
                        "rubric":  {
                                       "pass":  null,
                                       "notes":  "The response must identify the private native method, public Java wrapper, cloned input, and subtraction-based bounds check without inventing requirements.",
                                       "sourceFaithful":  null,
                                       "refusalCorrect":  null,
                                       "sourceShapeValid":  null,
                                       "manifestMatchVerified":  null,
                                       "contentRelevanceVerified":  null,
                                       "agentReviewRequired":  false,
                                       "sourceAttributionCorrect":  null
                                   }
                    },
                    {
                        "deployment":  "gpt-5-mini-2025-08-07",
                        "suite":  "Comparison",
                        "case":  "Synthesis",
                        "question":  "Synthesize the policy\u0027s guidance for handling untrusted text from receipt through logging, using the sections on validating inputs, Unicode normalization, and unsensitized log input.",
                        "config":  {
                                       "topK":  5,
                                       "similarityThreshold":  0.3,
                                       "embeddingDeployment":  "text-embedding-3-small-1",
                                       "collection":  "task2-default-20260903T190000Z"
                                   },
                        "latencyMs":  11610,
                        "httpStatus":  200,
                        "status":  "NOT_PROVEN",